id,Title,Text,pinecone_id
7934531f-aafe-4b0e-a0cd-242ffce69e85,"antecedentes documentos - Peón agrı́cola, con obesidad mórbida, sufre dolores articulares y di􀏐icultad para la movilidad. Su condición la limita para realizar su trabajo.","Las fuentes del informe en las que este perito se ha basado para la realización del presente documento han sido las siguientes, según orden cronológico:
•	Informe de consulta de médico de familia de fecha 23/04/2019 donde , tras la exploración, diagnostica una hernia abdominal de línea media.
•	Informe de consulta de Endocrinología de fecha 25/04/2019 para valoración previa a cirugía bariátrica: Refleja en el informe  en la parte de exploración una “obesidad extrema generalizada”.
•	Informe de consulta de neumología de fecha 17/06/2019: Diagnosticada de “Apnea del Sueño en estado grave”.
•	Informe médico de hoja de seguimiento de consulta de fecha 22/08/2019: “Paciente con Obesidad Mórbida Artrosis, Fibromialgia, Hipertensión arterial y Asma bronquial en tratamiento, con gran dificultad para la realización de trabajo físico”.
•	Informe médico de hoja de seguimiento de consulta de fecha 16/09/2021: Refiere la operación de hernia estrangulada y menciona sus patologías : SAHOS, fibromialgia, artrosis, gonartrosis avanzada de rodillas, pendiente de cirugía bariátrica.
•	Informe del Equipo de Valoración de Incapacidades de la S.S de fecha 21/09/2021: La médico inspector resalta en evaluación clínico-laboral que ""Limitación para actividades con requerimiento físico intensos en general”.
•	Anexo a la calificación EVI de fecha 23/09/2021: En dicho anexo basan la decisión de NO otorgarle la IPT en la siguiente observación: “ Hernia supraumbilical intervenida con buen resultado funcional y litiasis ecográfica sin sintomatología asociada en el momento actual. Situación que le permite su reincorporación. LIMITACIONES: SIN LIMITACIONES.”
",9b308d43-c85f-4b85-9f41-fa7cc35b3e0f
fcbcbc20-c661-4b2a-a488-de7653423c85,"antecedentes doctor - Peón agrı́cola, con obesidad mórbida, sufre dolores articulares y di􀏐icultad para la movilidad. Su condición la limita para realizar su trabajo.","Dª Maria del Carmen de profesión, según la clasificación de la Guía de Valoración Profesional del INSS 2014, peón agrícola, debido a su patología de obesidad mórbida, sufre un deterioro de su estructura ósea desde hace años que le acarrea dolores articulares generalizados y dificultad para la movilidad. La paciente comienza con molestias a nivel de ambas rodillas y de todo su esqueleto axial que se van acrecentado conforme pasa el tiempo hasta el punto de imposibilitarle el normal desarrollo de su vida además de causarle impotencia funcional importante ante cualquier postura mantenida y/o esfuerzo, e imposibilitándola para desenvolverse en las tareas más simples (informe médico de hoja de seguimiento de consulta de fecha 22/08/2019).
La evolución conforme pasan los meses va siendo cada vez más penosa  porque además se le van sumando nuevas complicaciones como SAHOS, fibromialgia y estado de ansiedad continuo.
Una vez fueron estudiadas y valoradas todas las alternativas de tratamiento y ante la única posibilidad existente que consiste en una intervención quirúrgica de tipo bariátrica, Dª Mª Carmen solicitó la valoración por el Equipo de Valoración de Incapacidades de la S.S donde la médico inspector resalta en la evaluación clínico-laboral que tiene ""Limitación para actividades con requerimiento físico intensos en general” y aun así, le negó  la incapacidad.
",8773221c-83fc-4838-9bed-059576345200
b1c70de9-486b-40c6-b9cb-d9eaa1290b59,"estado actual - Peón agrı́cola, con obesidad mórbida, sufre dolores articulares y di􀏐icultad para la movilidad. Su condición la limita para realizar su trabajo.","Tras el examen de la documentación antes referida, el perito mantiene el 22/02/2022 la entrevista con la paciente. De esta entrevista se extrae las siguientes conclusiones:
En la esfera psíquica refiere un estado de ánimo triste, con discurso de desmoralización, aunque coherente y fluido. Abordable, colaboradora, con juicio de realidad conservado. No refiere clínica de corte psicótico, aunque sí verbaliza desesperanza y angustia. Rumiación de ideas continúas relacionadas con su situación actual. 
Movimientos dolorosos de las articulaciones como signos llamativos en una primera inspección visual. Caminando con inestabilidad como consecuencia de las dolencias articulares en sus miembros inferiores.
En cuanto a su vida diaria refiere que tiene limitaciones para poder llevar las labores normales de su día. Reseña que padece de dolor crónico e incesante en la columna y en ambas rodillas en cuanto ejecuta algún tipo de actividad que requiera una mínima exigencia física (levantarse, mantenerse en bipedestación o desplazar objetos de pequeño tamaño por ejemplo).
EXPLORACIÓN  FÍSICA:
Paciente con movilidad tórpida por los dolores articulares y por la obesidad mórbida que presenta. Buen estado de cuidado personal y de nutrición.
La paciente ante la exploración física realizada presenta las siguientes características:
•	Región lumbar:

1.	Deficiencia de la región lumbosacra debida a limitación de flexión-extensión. La amplitud media de flexión-extensión es 120º (90º flexión, 30º extensión).
a.	Grado de flexión de la paciente → Realiza hasta los 30 grados. Déficit de 60 grados.
b.	Grado de extensión de la paciente → Realiza hasta los 5 grados. Déficit de 25 grados.
2.	Deficiencia de la región lumbosacra debida a limitación de flexión lateral y anquilosis. La amplitud media de flexión lateral es de 50º (25º flexión lateral derecha, 25º flexión lateral izquierda).
a)	Flexión lateral derecha de la paciente → Realiza hasta los 10 grados. Déficit de 15 grados.
b)	Flexión lateral izquierda de la paciente → Realiza hasta los 11 grados. Déficit de 14 grados.
3.	Componente basado en el déficit neurológico No patológico.
4.	Balance Muscular: Se considera útil para graduar la debilidad muscular la ESCALA DE DANIELS:
a)	Ausencia de contracción. 0/5
b)	Se ve o palpa la contracción, pero no hay movimiento. 1/5
c)	Se produce movimiento en ausencia de gravedad. 2/5
d)	Movimiento que vence la gravedad. 3/5
e)	Hay fuerza contra la resistencia del examinador. 4/5
f)	Fuerza normal.
Todo esto secundado por las siguientes pruebas exploratorias:
1.	Pruebas de distancia dedos-suelo: (prueba de movilidad de todo el eje vertebral) Limitado a pasar solo las rodillas (grado 3).
2.	Signo de Ott positivo (disminución de la movilidad de la columna dorsal).
3.	Signo de Schober positivo (disminución de la movilidad de la columna lumbar).
4.	Prueba de rotación de la columna cervical: Limitación de la movilidad no cumpliendo todos los grados posibles, con detención brusca del mismo y dolor (indicativo de trastornos degenerativos como la espondiloartrosis).
5.	Prueba de percusión de las apófisis espinosas vertebrales positivas: Dolorosas. Indica inflamación o alteración ligamentosa a esos niveles.
6.	Prueba de Spurling positiva: Dolor en las carillas articulares vertebrales a la maniobra indicando irritación de las carillas articulares o una compresión de las raíces nerviosas.
7.	Prueba de hiperextensión lumbar positiva: Dolor intenso e incapacidad a la realización de la prueba.
•	Miembro inferior derecho (rodilla): Buena coloración de la piel con pulsos pedio, poplíteo y femoral conservado. La exploración arroja los siguientes resultados:
1.	Flexión-Extensión: 140 grados de amplitud media (140 grados flexión, 0 grados extensión). La limitación es de 120 grados de flexión y 0 grados de extensión.
2.	Balance Muscular: Se considera útil para graduar la debilidad muscular la ESCALA DE DANIELS:
1.	Ausencia de contracción. 0/5
2.	Se ve o palpa la contracción, pero no hay movimiento. 1/5
3.	Se produce movimiento en ausencia de gravedad. 2/5
4.	Movimiento que vence la gravedad. 3/5 (aunque no puede mantenerla por más de 5 segundos aproximadamente).
5.	Hay fuerza contra la resistencia del examinador. 4/5.
6.	Fuerza normal.
•	Miembro inferior izquierdo (rodilla): Buena coloración de la piel con pulsos pedio, poplíteo y femoral conservado. La exploración arroja los siguientes resultados:

1.	Flexión-Extensión: 140 grados de amplitud media (140 grados flexión, 0 grados exten",f81e04f7-d5cb-40a1-9958-56390fd0f0c6
e697f3f3-fd03-4158-8231-6d1bbd0ee909,"consideraciones medico-legales - Peón agrı́cola, con obesidad mórbida, sufre dolores articulares y di􀏐icultad para la movilidad. Su condición la limita para realizar su trabajo.","Dª Mª Carmen es una paciente que padece de obesidad mórbida en grado extremo (como así lo indica el informe de consulta de Endocrinología de fecha 25/04/2019 para valoración pre-via a cirugía bariátrica) y al que se le asocia una serie de patologías traumatológicas como artro-sis generalizadas y precoces para la edad que tiene que hace que desarrolle dolores intensos a nivel de toda la columna vertebral y las rodillas, y que son crónicas ya que la deformación ósea que ha adquirido con el paso del tiempo es irreversible. 
A parte de la patología traumatológica también padece de fibromialgia, síndrome de apnea del sueño y cuadro ansioso (informe médico de hoja de seguimiento de consulta de fecha 16/09/2021).
Estas patologías le acarrea la atención continuada por diferentes equipos de especialistas y con diferentes tratamientos, con visitas continuas a los servicios de traumatología, MAP , endo-crino y cirugía para buscar la alternativa de tratamiento más beneficiosa para la paciente. 
Recurre a tratamiento farmacológico incesantemente debido a las severas restricciones para la movilidad, dolores continuos y limitaciones para el desarrollo de actividades diarias y en el momento que estaba en su trabajo (que requería pasar horas en posición de bipedestación y posiciones no ergonómicas por las diferentes posturas que tenía que realizar así como por el con-tinuo peso que tenía que coger). 
El trabajo desempeñado por la paciente requiere una serie de características y mínimas capacidades musculares que a continuación se detallan, basándonos en la Guía de Valoración Profesional de la Seguridad Social de 2014:
•	Los peones agrícolas (excepto en huertas, invernaderos, viveros y jardines) realizan tareas sencillas y rutinarias en la producción de cultivos extensivos y cultivos leñosos, tales como frutas, nueces, granos y hortalizas en explotaciones agrícolas. No conducen maquinaria agrícola.
•	Entre sus tareas se incluyen:
1.	Cavar y apalear para limpiar zanjas o para otros fines.
2.	Cargar y descargar suministros, productos y otros materiales.
3.	Rastrillar, lanzar y apilar paja, heno y materiales similares.
4.	Regar, ralear y desherbar cultivos a mano o utilizando herramientas manuales.
5.	Recoger frutas, nueces, hortalizas y otros cultivos.
6.	Plantar y cosechar cultivos, tales como el arroz, a mano.
7.	Clasificar, ordenar, agrupar y envasar productos en recipientes.
8.	Realizar reparaciones menores en instalaciones, edificios, equipos y cercos.


	                      PEÓN AGRÍCOLA	
REQUERIMIENTOS	GRADO		REQUERIMIENTOS	GRADO	
	1	2	3	4			1	2	3	4
Carga física				X		Carga mental		
Carga biomecánica			Comunicación	X			
Columna cervical			X			Atención al público	X			
Columna dorso-lumbar				X		Toma de decisiones	X			
Hombro			X			Atención/complejidad	X			
Codo			X			Apremio		X		
Mano			X			Dependencia		X		
Cadera			X			Visión		
Rodilla			X			Agudeza visual		X		
Tobillo/pie				X		Campo visual		X		
Manejo de cargas				X		Audición	X			
Trabajo de precisión	X					Voz	X			
Sedestación	X					Sensibilidad		
Bipedestación			Superficial		X		
Estática		X				Profunda			X	
Dinámica			X		 	
Marcha por terreno irregular			X			

Su enfermedad demanda una serie de explicaciones para entender mejor las restricciones que padece la paciente. Según el Manual de actuación para médicos del INSS (F. Alvarez. E. Jardón. Instituto Nacional de la Seguridad Social. 2011) se establecen 5 grados de valoración funcional según el grado de obesidad:
•	Grado 0: IMC 25-29,9 (sobrepeso). Sin complicaciones asociadas. Analítica con posibles factores de riesgo cardiovascular (dislipemia, hiperglucemia); Pueden llevar tratamiento con dieta y ejercicio, no llevan tratamiento farmacológico.
 Conclusiones: No precisa incapacidad temporal.
•	Grado 1: IMC 30-35 (obesidad grado II). Presenta complicaciones asociadas en grado leve o compensadas con el tratamiento. Analítica nos indica la existencia de síndrome metabólico (hiperglucemia, dislipemia, HTA). Presenta alguna complicación en grado leve como episodios de flebitis aguda, artropatía de rodillas, cardiopatía, SAHOS, estando bien compensado con tratamiento. 
Conclusiones: Capacidad laboral limitada por la obesidad en determinadas situaciones: atletas, ejercicios físicos extenuantes. Se contempla la posibilidad de mejoría con la pérdida de peso. 
•	Grado 2: IMC 35-40 (obesidad grado III o 40 o menor con enfermedades asociadas en grado severo sin respuesta a la dieta o tratamiento farmacológico y/o quirúrgico. Pacient",81dd1fbd-043f-447c-bf74-dfd8f96fb7f2
6238db50-c435-4511-8662-b138f1247cc0,"conclusiones - Peón agrı́cola, con obesidad mórbida, sufre dolores articulares y di􀏐icultad para la movilidad. Su condición la limita para realizar su trabajo.","PRIMERA
La paciente sufre de una patología de obesidad mórbida que repercute en su salud en los ámbitos traumatológicos, del sueño y psicológicos, solo con opciones terapéuticas a través de intervención quirúrgica de cirugía bariátrica sin poder asegurar el éxito de la misma.
SEGUNDA
Se entiende el impedimento para realizar su trabajo de peón agrícola en condiciones óptimas, con una garantía mínima de profesionalidad y con las exigencias mínimas de continuidad, rendimiento, eficacia y esfuerzo exigibles, ya que no puede mantener posturas forzadas ni sostener un tono muscular adecuado para permitirle la ejecución de las tareas propias de su oficio durante horas sin dolor e impotencia funcional.
TERCERA
	En el anexo a la calificación del Equipo de Valoración de Incapacidades de fecha 23/09/2021 basan la decisión de NO otorgarle la IPT en diagnósticos en donde no han tomado en consideración, ni siquiera mencionado, la obesidad mórbida (véase “Hernia supraumbilical intervenida con buen resultado funcional y litiasis ecográfica sin sintomatología asociada en el momento actual. Situación que le permite su reincorporación. LIMITACIONES: SIN LIMITACIONES”).
	Además, en el mismo anexo el mismo Equipo de Valoración de Incapacidades se lleva así mismo la contraria al señalar que no tiene limitaciones y en cambio en su propio informe de síntesis de la médico inspectora del 21/09/2021, 2 días antes, refleja en el apartado de evaluación clínico-laboral que tiene ""Limitación para actividades con requerimiento físico intensos en general”.
",24ddc157-0a78-49f0-87a0-5bdbc7c74775
cfc591cb-c85d-45f8-9780-d78533a2c814,"antecedentes documentos - 58 años, conductor de camiones. Se le diagnosticó espondiloartrosis, hernia discal y rotura del supraespinoso. Su condición le impide trabajar.","Las fuentes del informe en las que este perito se ha basado para la realización del presente documento han sido las siguientes, según orden cronológico:
1.	Informe del 19/12/2017 - Hospital Quironsalud Infanta Luisa: Tratado por un accidente laboral que causó dolor en la espalda baja y el hombro izquierdo. Diagnosticado con lumbalgia y esguince de hombro izquierdo. Recibió medicación y se le aconsejó usar un cabestrillo.
2.	Informe del 14/06/2022 - H.U. Virgen del Rocío, Traumatología General: Paciente con dolor en el hombro y la espalda baja, con antecedentes desde 2018. Recibió Tramadol/dexketoprofeno y se solicitó resonancia magnética de la columna lumbar y ecografía del hombro izquierdo para evaluación adicional.
3.	Informe del 25/07/2022 - A.H. Virgen del Rocío, Radiodiagnóstico: La resonancia magnética revela signos leves de espondilosis. En la zona lumbar, se observa disminución de la señal en los discos L1-2 y L4-5, con protrusiones de los anillos fibrosos y desgarros. Se detecta espondiloartrosis, deshidratación y hernia discal en L4-5.
4.	Hospital Universitario Virgen del Rocío - 24/10/2022: Se diagnostica espondiloartrosis y hernia discal en la columna lumbar, y rotura de espesor completo y casi completo del supraespinoso en el hombro izquierdo.
5.	Hospitales Universitarios Virgen del Rocío - 31/01/2023: El paciente se somete a cirugía artroscópica de hombro izquierdo debido a una rotura de espesor completo del manguito rotador y cambios degenerativos en la articulación acromioclavicular.
6.	Hospital de Rehabilitación y Traumatología Virgen del Rocío - 10/05/2023: Después de artroscopia de hombro izquierdo, se estableció un plan de ejercicios y rehabilitación.
7.	Hospital de Rehabilitación y Traumatología Virgen del Rocío - 12/07/2023: El paciente sigue con dolor y limitación de movilidad en el hombro izquierdo después de 3 meses. Se le cita para revisión.
8.	Hospital Virgen de Valme - 03/08/2023: Tras artroscopia de hombro izquierdo, se identificaron lesiones SLAP y rotura parcial del PLB y supraespinoso. Se realizó tratamiento quirúrgico y se estableció un plan de fisioterapia.
9.	Hospital Universitario Virgen de Valme - 21/12/2023: Después de fisioterapia, el paciente sigue con dolor cervical, lumbar, codos y muñecas debido a fibromialgia, raquialgia crónica y discopatía lumbar. Se le practicó artroscopia de hombro izquierdo y se le dio de alta con recomendaciones.
10.	Servicio de Medicina Física y Rehabilitación - H.U.V. Valme - 19/03/2024: El paciente muestra debilidad en la pierna izquierda y dolor cervical con irradiación. Se diagnostica raquialgia crónica, fibromialgia y discopatía lumbar. Se solicita resonancia magnética cervical y se le aconseja evitar conducir y levantar pesos.
11.	Quironprevencion - 18/04/2024: El paciente tiene patología osteomuscular crónica. Se evalúa su calidad de vida y su situación laboral, refiriendo que es nula.
",d2299c47-9b5c-44a1-beb6-63edef8b833c
cc52f1d4-42ca-4dfc-95ed-95b9cb56de1e,"antecedentes doctor - 58 años, conductor de camiones. Se le diagnosticó espondiloartrosis, hernia discal y rotura del supraespinoso. Su condición le impide trabajar.","Dª Manuel Sánchez Caballero de 58 años, y de profesión, según la clasificación de la Guía de Valoración Profesional del INSS 2014, conductor de camiones, camionetas y automóviles de carga, sufre un deterioro de su estructura ósea desde hace años que le acarrea dolores articulares a nivel cervical, lumbar y de miembro superior izquierdo con impotencia funcional gradual. Comenzó con estos problemas de salud de manera progresiva e intermitente en el tiempo, con periodos de mejoría, pero sin remitir del todo ni estar asintomático. Su historial médico revela una serie de intervenciones y diagnósticos que han marcado su trayectoria clínica.
El historial médico de D. Manuel Sánchez Caballero discurre a través de una secuencia de eventos que revelan una trayectoria compleja de problemas osteomusculares. Comenzando en diciembre de 2017, tras un accidente laboral que involucró un movimiento brusco al intentar evitar la caída de unas cajas, presentando dolor lumbar y un esguince en el hombro izquierdo, según el informe del Hospital Quironsalud Infanta Luisa. Aunque las radiografías no mostraron lesiones óseas significativas, el dolor persistió, marcando el inicio de su contingencia médica.
En junio de 2022 presenta omalgia (dolor de hombro) y lumbalgia mecánica, y el Hospital Universitario Virgen del Rocío indicó la necesidad de realizar estudios adicionales mediante resonancia magnética y ecografía para una evaluación más exhaustiva de las regiones afectadas. La persistencia de estas dolencias motivó la recomendación de dichos estudios. Cabe destacar que el historial médico del paciente revelaba antecedentes de protusiones discales lumbares, diagnosticadas a través de una resonancia magnética nuclear en 2018. Esta información apunta a una condición crónica de la columna vertebral que requería seguimiento continuo y posiblemente un enfoque terapéutico adaptado a la evolución de los síntomas y a los hallazgos radiológicos.
El 24 de octubre de 2022, el paciente fue informado de los hallazgos ultrasonográficos que evidenciaron una ruptura de espesor total y subtotal del tendón del manguito de los rotadores del hombro izquierdo. Además, se observaron signos de artropatía degenerativa en la articulación acromioclavicular, lo cual respaldaba la indicación de realizarle una intervención quirúrgica por vía artroscópica. De manera concurrente, la imagenología por resonancia magnética nuclear demostró la presencia de espondiloartrosis y compromiso discal lumbar, caracterizado por una hernia de núcleo pulposo y protrusiones discales en los niveles vertebrales L1-L2 y L4-L5, respectivamente. 
En mayo de 2023, D. Manuel se sometió a la mencionada artroscopia de hombro izquierdo, donde se identificaron un SLAP tipo 1 y roturas parciales en el PLB y el supraespinoso. A pesar del procedimiento, los síntomas en el hombro persistieron, lo que condujo a la vigilancia del proceso de recuperación con terapia rehabilitadora según el informe del Hospital Universitario Virgen del Rocío.
Dº Manuel, a lo largo de este tiempo, fue objeto de un seguimiento continuo por parte de su Médico de Atención Primaria (MAP), con interconsultas frecuentes en las especialidades de Rehabilitación y Traumatología. A lo largo de su evolución clínica, se ha visto en la necesidad de instaurar una terapia analgésica multimodal, de variada intensidad y espectro, debido a la refractariedad del síndrome doloroso que padece. Las crisis álgidas han requerido la intervención de los servicios de urgencias para intentar paliar de alguna forma el dolor.
A su vez, se establecieron diagnósticos concomitantes de fibromialgia y raquialgia crónica, entidades que han contribuido a la exacerbación del cuadro clínico. 
A pesar de la implementación de múltiples abordajes terapéuticos, incluyendo procedimientos quirúrgicos y programas de rehabilitación física intensiva, la sintomatología dolorosa y la disfunción física persistían.
El último informe de rehabilitación del Servicio de Medicina Física y Rehabilitación del Hospital Universitario Virgen de Valme, fechado en marzo de 2024, ha sido especialmente concluyente respecto a la mala evolución que llevaba D. Manuel. Se le recomendó enfáticamente que evitase cargar peso y abstenerse de conducir, lo cual es crucial para prevenir el agravamiento de su condición, y subraya las limitaciones significativas con las que se enfrenta en su capacidad para trabajar (Informe del Servicio de medicina Física y Rehabilitación del H. U. V. Valme de fecha 19",759ac52f-7e4f-4744-8f20-6d3b4c94dd8d
