id,Title,Text,pinecone_id
5e42298b-1029-4207-beee-8754a5dc66d2,"estado actual - 46 años, trabajadora de la ONCE, padece enfermedad de Crohn con colostomı́a, ceguera congénita en ojo derecho, coxalgia izquierda y pérdida de agudeza visual en ojo izquierdo. La enfermedad ha evolucionado con complicaciones, requiriendo intervenciones quirúrgicas y tratamiento paliativo","La paciente presenta como antecedente de interés:  
•	Ceguera de ojo derecho congénita.
•	Pérdida de agudeza visual de ojo izquierdo.
•	Colostomía por complicación de la enfermedad de Crohn.
•	Coxalgia a la espera de sustitución de prótesis de cadera.
 
En la cita que se realiza el 15/12/2020 la enferma se presenta ante este perito con buen aspecto y con la dificultad propia del dolor en cadera izquierda y de tener visión escasa en su único ojo.
EXPLORACIÓN FÍSICA
Paciente con buen estado general, orientada y colaboradora, con un aspecto físico bueno. 
A la inspección presenta buena coloración de piel y mucosas y buen estado de cuidado personal y de nutrición. 
Dª Inmaculada ante la exploración física realizada y basándonos en sus patologías presenta las siguientes características: 
•	ARTICULACIÓN MIEMBRO INFERIOR IZQUIERDO: Buena coloración de la piel con pulsos pedio, poplíteo y femoral conservado. La exploración arroja los siguientes resultados:
1.	Abducción y aducción: Se encuentra 60º de amplitud media (40º abducción, 20º aducción) y Dº Milagros tiene limitaciones a los últimos grados ( abducción 25º y aducción 15º).
2.	Rotación interna y externa: Rotación interna-externa con 90º de amplitud media (40º R. interna, 50º R. externa). La paciente presenta una movilidad reducida que solo le permite llegar hasta 25º de R. Interna y 25º de R. Externa).
3.	Flexión-Extensión: 130º de amplitud media ( 100º flexión, 30º extensión). La limitación es de 70º de flexión y 20º de extensión.
 
Conservación de la pronosupinación y de los reflejos osteotendinosos. 
1.	Balance Muscular: Se considera útil para graduar la debilidad muscular la ESCALA DE DANIELS: 
 
a.	Ausencia de contracción. 0/5 
 
b.	Se ve o palpa la contracción pero no hay movimiento. 1/5 
 
c.	Se produce movimiento en ausencia de gravedad. 2/5 
 
d.	Movimiento que vence la gravedad. 3/5 ( aunque no puede mantenerla por más de 5 segundos aproximadamente) 
 
e.	Hay fuerza contra la resistencia del examinador. 4/5 . La Paciente se encuentra en este punto.
 
f.	Fuerza normal. 
",b7a09b89-2db4-4083-9084-580c71ef567b
5cfdf943-065e-4a8a-984f-0f859d691132,"consideraciones medico-legales - 46 años, trabajadora de la ONCE, padece enfermedad de Crohn con colostomı́a, ceguera congénita en ojo derecho, coxalgia izquierda y pérdida de agudeza visual en ojo izquierdo. La enfermedad ha evolucionado con complicaciones, requiriendo intervenciones quirúrgicas y tratamiento paliativo","Dª Milagros Gálvez Reyes, como consecuencia de la amputación abdominoperineal y colostomía definitiva debido a su enfermedad de Crohn, ha requerido y requiere la atención continua por diferentes equipos de especialistas y con diferentes procedimientos, así como visitas al servicio de cirugía para someterse a diversos controles. Esto se debe a que su curso fue desfavorable al complicarse con una estenosis de la misma. 
Para entender mejor la repercusión que puede tener la afirmación anterior se explica a continuación este concepto:
Una estenosis de colostomía es la reducción del diámetro del orificio del estoma de tal forma que impide la realización de un tacto por el mismo y de la evacuación de heces. Puede ser secundaria a complicaciones del postoperatorio inmediato como: necrosis, infección o retracción de la colostomía, o a complicaciones tardías en las que se ha producido cicatrización por segunda intención, sobreinfecciones u otro tipo de consecuencias adversas.
Esto obliga a los cirujanos a la reparación de la misma, resecándola, movilizándola y reubicándola con el consiguiente aumento de las probabilidades de complicaciones (gangrena de la colostomía que se produce por sección de la vascularización del estoma, retracción de la colostomía, hernia paracolostomía, infección o absceso cutáneo, dermatitis, hemorragia por colostomía, prolapso de la colostomía y la reestenosis) al tener que operar una zona ya intervenida y con los tejidos dañados, debilitados y desestructurados previamente.
Es decir, los cirujanos son conscientes de los problemas que puede acarrear una nueva operación para la paciente pero aun así deciden acometer la misma, manifestando con este hecho la mala evolución que ha seguido la ostomía hasta la actualidad.
También conviene puntualizar una serie de características en el manejo de la colostomía y que ayuda a comprender las dificultades por las que pasa la Sra. Gálvez en el momento de asaltar sus actividades:
1.	Vaciar la bolsa de colostomía: Hay que vaciar la bolsa cuando alcance alrededor de una tercera parte de su capacidad para evitar que se llene mucho y tenga fugas, siguiendo estos pasos:
•	Sentarse en el inodoro tan atrás como pueda o en una silla frente al escusado.
•	Colocar una pequeña tira de papel sanitario en el inodoro para disminuir las salpicaduras.
•	Sujetar la parte inferior de la bolsa hacia arriba y abrir el sujetador en el extremo.
•	Lentamente desenrollar el extremo sobre el inodoro.
•	Vaciar suavemente el contenido.
•	Limpiar tanto el lado externo e interno del extremo de la bolsa con papel sanitario.
•	Enrollar el extremo de la bolsa y el clip.
Hay distintos sistemas de bolsa recolectora según el plazo de utilización. Algunas se cambian cada día, otras alrededor de cada tres días y algunas una vez por semana dependiendo del tipo de bolsa elegida.
La Sra. Gálvez tiene la necesidad de cambiar la bolsa con una frecuencia alta y sin posibilidad de establecer unos horarios debido a que al tener la complicación de la estenosis de la colostomía y los síntomas acompañantes debe de tener una higiene escrupulosa para evitar posibles sobreinfecciones. Esto le causa una situación muy limitada para realizarlo en un ambiente de intimidad y salubridad adecuada al momento.
2.	Gas (flatulencia o meteorismo): Tras la cirugía puede experimentarse la emisión de muchos gases todo el tiempo. Tras la mayoría de las cirugías del abdomen ocurre este incómodo y bochornoso, pero inofensivo síntoma. Los ruidos de los gases o los sonidos estomacales pueden ser una preocupación. Ciertas comidas pueden causar gas, como huevos, repollo, brócoli, cebollas, pescado, frijoles, leche, queso, bebidas carbonatadas y alcohol. El comer bajo un horario establecido puede ayudar a evitar los gases. Comer pequeñas cantidades de alimentos de 4 a 5 veces al día y no omitir comidas para evitar los gases o las descargas.
Como es obvio, la Sra. Gálvez no puede desempeñar una función con diligencia y concentración si tiene que estar pendiente de dichos síntomas y, menos, desarrollar una empatía y normal interacción con otras personas de su entorno sin sentir un estado de perturbación y vergüenza continuo. A parte de no poder elegir el horario de comidas según le convenga a ella.
3.	Olor: Muchos factores, como la comida, las bacterias que normalmente hay en el intestino, las enfermedades, ciertas medicinas y las vitaminas pueden causar olor.
Algunos alimentos pueden producir olores: los huevos, el repollo, el queso, los ",d8cd19e8-9edc-4c1f-8e44-fd6f65af8638
2b060c9c-3970-4a3d-9294-564d7abb615f,"conclusiones - 46 años, trabajadora de la ONCE, padece enfermedad de Crohn con colostomı́a, ceguera congénita en ojo derecho, coxalgia izquierda y pérdida de agudeza visual en ojo izquierdo. La enfermedad ha evolucionado con complicaciones, requiriendo intervenciones quirúrgicas y tratamiento paliativo","PRIMERA: 
Los síntomas físicos causados por la enfermedad de Crohn y su tratamiento quirúrgico, y las enfermedad oftalmológica son crónicos e irreversibles. 
SEGUNDA:
A pesar del tratamiento al que la paciente ha sido sometida, la evolución de su sintomatología ha sido progresiva y con dificultad por parte de los especialistas para controlarla, llegando a un punto en el que tienen que intervenirla quirúrgicamente con las altas posibilidades de que sufra más complicaciones en un futuro.
TERCERA:
La paciente se encuentra limitada por el problema de la colostomía y de la baja capacidad visual para ejercer cualquier trabajo, puesto que cualquier trabajo impone un mínimo de atención, destreza, diligencia y agilidad que Dª Milagros no puede asumir por la invalidez para desenvolverse en su entorno debido a la deficiencia visual bilateral así como al estar más pendiente de las mínimas medidas higiénicas necesarias y de respetar las normas básicas sociales exigibles de una convivencia civilizada entre personas, menoscabándola incluso en sus propias actividades de la vida diaria.
",fdc80d44-08af-4c96-95c3-7f41d867be50
761b61ea-b899-4225-8ff9-b9894d6b1651,"antecedentes documentos - 55 años, sufrió epicondilitis derecha mientras trabajaba como jardinera. La patologı́a evolucionó a crónica, limitando su capacidad para realizar tareas que requieren esfuerzo del brazo.","Las fuentes  del  informe  en  las  que  este perito  se  ha  basado para  la  realización del presente documento han sido las siguientes, según orden cronológico: 
 
1.	Informe Clínico de su médico de Atención Primaria de fecha de 23/11/2015: Recoge la patología de la paciente “paciente que estando podando en una arboleda y acude por dolor en hombro y codo derecho. El dolor le provoca impotencia funcional”. A la exploración “dolor en epicóndilo con prono-supinación dolorosa. Flexión dorsal de muñeca contraresistencia con dolor”. 
 
2.	Partes de baja laboral de su Médico de Atención Primaria del 23/11/2015: Recoge la causa de su baja laboral refiriendo “epicondilitis bilateral secundaria a trabajo de podadora”. 
 
3.	Informe de Asepeyo del 15/12/2015: Refiere que mientras estaba podando con tijera y con serrucho comienza con edema de manos y cambio de coloración de las uñas, así como con dolor. A la exploración “contractura dolorosa con crepitación en el trapecio derecho, con limitación dolorosa a la movilidad cervical. Zona de vitíligo en el epicóndilo derecho secundaria a infiltraciones, con test exploratorios positivos para epicondilitis”. 
 
4.	Informe del servicio de Medicina Física y Rehabilitación 15/02/2016: Describen el motivo de derivación de la paciente como: “Tendinopatía del extensor común del carpo”. 
 
5.	Informe de Asepeyo del 10/05/2016: Estudios de RNM de codo derecho diagnosticando epicondilitis crónica lateral y RNM cervical con resultado de inversión lordosis cervical y discoartrosis segmento c4-c7. En rehabilitación en ese centro desde el 18/02/2016 con 50 sesiones realizadas. 
 
6.	Informe Clínico de su médico de Atención Primaria de fecha de 19/05/2016: Indica que la paciente presenta “dolor en codo derecho y dice haber tenido 3º dedo de mano derecha en resorte. A la inspección presenta dolor en epicóndilo con imitación en la prono-supinación forzada y dolor a la flexión dorsal de mano forzada” 

7.	Hoja de seguimiento de consulta del médico de familia de fecha 26/11/2021: Recoge que mantiene la incapacidad a la movilidad del brazo, antebrazo y mano por la epicondilitis. Refiere que tiene que evitar coger peso.

8.	Vida laboral de la paciente.
",98658a23-d9e6-49dd-a5a6-c5696e43a539
4770c39d-ddf8-4696-8010-34b01939807e,"antecedentes doctor - 55 años, sufrió epicondilitis derecha mientras trabajaba como jardinera. La patologı́a evolucionó a crónica, limitando su capacidad para realizar tareas que requieren esfuerzo del brazo.","Dª INMACULADA PIRIS FRAILE de 55 años, y de profesión, según la clasificación de la Guía de Valoración Profesional del INSS 2014, trabajadora cualificada en huertas, invernaderos, viveros y jardines, con antecedentes de dolores desde hace años centrados en la región cervical, paracervical, hombros, codo y antebrazo derecho (tuvo consultas médicas por epicondilitis del mismo codo previamente hace años), sufre el día 23/11/2015, estando trabajando con herramientas de jardinería, un dolor agudo intenso en región de codo y brazo derecho que le impide continuar con el mismo. 
Al haber ocurrido la patología en su puesto de trabajo (como se recoge en el informe clínico de su médico de Atención Primaria de fecha de 23/11/2015 y en los partes de baja laboral de su Médico de Atención Primaria del 23/11/2015), la paciente acudió a su mutua de trabajadores donde, una vez diagnosticada de epicondilitis derecha, comienzan a tratarla con medicación analgésica y reposo. 
Debido a la situación clínica de la paciente, a las características de la patología y a que sus síntomas aumentaban cuando realizaba ciertos movimientos como la abducción y elevación de los brazos (tan frecuente en sus labores), le es necesario acogerse a la baja laboral ya que en su trabajo es imprescindible que se tenga una armonía perfecta entre fuerza y coordinación motora de los miembros superiores y columna vertebral para manejar los utensilios de trabajo con la eficacia y agilidad requerida.
 En los siguientes meses no mejora, sino que empeora y se agrava con un dolor que va en aumento y que le produce una incapacidad funcional del brazo intensa. Tienen que recurrir a las infiltraciones con corticoides para intentar paliar el dolor y la inflamación. 
Se decide practicar estudios médicos para conocer el alcance de la patología y por la persistencia del dolor. En la resonancia magnética practicada escriben como conclusión: “epicondilitis crónica lateral e inversión lordosis cervical y discoartrosis segmento c4-c7”.  
Dª Inmaculada, en este periodo de tiempo, a parte del seguimiento por su MAP (médico de atención primaria), estuvo en sucesivas consultas de rehabilitación (informe del servicio de Medicina Física y Rehabilitación 15/02/2016), donde le administraron hasta 50 sesiones de rehabilitación sin mejoría, lo que confirma el difícil tratamiento y la cronicidad de su enfermedad.
Desde entonces, ha ido empeorando progresivamente, teniendo que recurrir a su MAP frecuentemente y hasta la actualidad (informe Clínico de su médico de Atención Primaria de fecha de 19/05/2016; hoja de seguimiento de consulta del médico de familia de fecha 26/11/2021) con el fin de aliviarle o paliarle en cierto grado el dolor y probando nuevos fármacos. 
",f3b3e477-f432-4e26-a21d-52dbb2a272aa
3f0aa7b7-58b5-4998-8167-aba79e8e5cef,"estado actual - 55 años, sufrió epicondilitis derecha mientras trabajaba como jardinera. La patologı́a evolucionó a crónica, limitando su capacidad para realizar tareas que requieren esfuerzo del brazo.","La paciente presenta como antecedente de interés: 
 
•	Prótesis de cadera izquierda. 
 
En la cita que se realiza el 04/10/2016 la enferma se presenta ante este perito con buen aspecto y movilidad. 
EXPLORACIÓN FÍSICA
Paciente con buen estado general, orientada y colaboradora, con un aspecto físico bueno. 
A la inspección presenta buena coloración de piel y mucosas y buen estado de cuidado personal y de nutrición. 
Dª Inmaculada ante la exploración física realizada y basándonos en sus patologías presenta las siguientes características: 
 
• 	ARTICULACIÓN HUMERO-RADIO-CUBITAL: 
 
Durante el examen clínico se desencadena dolor a la palpación del epicóndilo lateral o en la zona inmediatamente anterior, así como dolor con la extensión contra resistencia de la muñeca. Existen diferentes pruebas clínicas que ayudan al diagnóstico clínico: 
 
1.	Test de Thompson: Prueba provocativa, hombro en flexión de 60º, codo extendido, antebrazo en pronación y muñeca en extensión de 30º. El examinador aplica una presión moderada en el dorso del segundo o tercer metacarpiano con lo cual se genera estrés al extensor carpiradialisbrevis y longus. Positivo. 
 
2.	Test de la silla: Prueba provocativa, se le solicita al paciente que levante una silla liviana con el codo extendido y el antebrazo en supinación con el objetivo de desencadenar dolor en el epicóndilo lateral. Positivo. 
 
3.	Test de borden: Prueba provocativa, se le pide al paciente que comprima un manguito de tensiómetro manteniendo una presión determinada. Positivo. 
 
4.	Test de Cozen: Se le ordena al paciente que realice flexión de codo y extensión de muñeca contra resistencia para de esta manera desencadenar el dolor. Positivo. 
 
5.	Miembro superior derecho: Buena coloración de la piel con  pulso  radial  y  humeral  conservado.  La  posición  funcional  normal  se encuentra entre los 40 y 20º de flexión y Dª Inmaculada tiene conservada la totalidad de la movilidad con limitaciones a los últimos grados de flexión, extensión, prono-supinación de codo, y también tiene una pérdida de la fuerza y dolor para mantener una postura del codo del brazo derecho en un ángulo aproximado de entre 90º y en supinación, que es la posición anatómica necesaria e imprescindible para desempeñar su trabajo con normalidad. 
 
Conservación de la pronosupinación y de los reflejos osteotendinosos. 
Balance Muscular: Se considera útil para graduar la debilidad muscular la ESCALA DE DANIELS: 
 
a.	Ausencia de contracción. 0/5 
 
b.	Se ve o palpa la contracción pero no hay movimiento. 1/5 
 
c.	Se produce movimiento en ausencia de gravedad. 2/5 
 
d.	Movimiento que vence la gravedad. 3/5 ( aunque no puede mantenerla por más de 5 segundos aproximadamente) 
 
e.	Hay fuerza contra la resistencia del examinador. 4/5 . La Paciente se encuentra en este punto.
 
f.	Fuerza normal. 

",5035cf99-0a0d-4ead-901c-1d17faba3d9f
d0ad6475-6969-4216-932c-beab23f2db8b,"consideraciones medico-legales - 55 años, sufrió epicondilitis derecha mientras trabajaba como jardinera. La patologı́a evolucionó a crónica, limitando su capacidad para realizar tareas que requieren esfuerzo del brazo.","La epicondilitis son lesiones por trauma acumulativo y son lesiones de tejidos blandos crónicas, producidas por un daño físico que se produce a través de un periodo de tiempo y están caracterizadas por el sobre uso o esfuerzo repetido de ciertas articulaciones y sus tejidos blandos circundantes.  Está demostrado que el tabaquismo, la obesidad, los movimientos repetitivos y las actividades enérgicas, independientemente entre sí, mostraron asociaciones significativas con la epicondilitis (Shiri R, Viikari-Juntura E, Varonen H, Heliovaara M. Prevalence and Determinants of Lateral and Medial Epicondylitis: A Population Study. Am J Epidemiol. 2006;164:1065-74). 
Este concepto se basa en la teoría de que cada repetición de alguna actividad produce un micro trauma, dando como resultado el deterioro de la estructura. Estas lesiones se producen generalmente cuando se rebasa la capacidad de respuesta del sujeto o la temporalidad necesaria para la recuperación biológica de los tejidos, y están ligadas al tipo de ocupación del paciente y condiciones de trabajo que ejecuta. 
El dolor se incrementa con la extensión de la muñeca y con la supinación del antebrazo. 
La paciente Dª INMACULADA PIRIS FRAILE, presenta un cuadro patológico traumatológico de difícil control y tratamiento, como así lo demuestran los especialistas que la han estado tratando (informe del servicio de Medicina Física y Rehabilitación 15/02/2016) al afirmar su cronificación, los diferentes cambios de tratamientos a los que se ha sometido y que no han sido capaz de paliarlo; como así lo describe su médico de familia en el último informe de fecha 26/11/2021.
Esta patología se desencadena, de manera indudable, cuando estaba trabajando en su puesto de trabajo, como así lo confirman las historias clínicas de su MAP (informe Clínico de su médico de Atención Primaria de fecha de 23/11/2015; partes de baja laboral de su Médico de Atención Primaria del 23/11/2015). 
Para ello vamos a analizar la causalidad según los criterios de causalidad médico-legal de Muller y Cordonnier: 
 
1.	Criterio etiológico-cualitativo: Está comprobado médicamente que un trabajo de estas características pueden causar la sintomatología y lesiones descritas. 
 
2.	Criterio cuantitativo: Con la ingente experiencia traumatológica de epicondilitis que se tiene recogida en las historias clínicas se puede afirmar que la acción y tareas del trabajo como se describe en este caso sí que puede producir las secuelas que se han indicado. 
 
3.	Criterio topográfico: O de concordancia de localización entre la zona anatómica afectada por el agente lesivo y en la que ha hecho su aparición el daño. Que en el caso que nos ocupa también es confirmado. 
 
4.	Criterio cronológico o criterio de tiempo que se corresponde con el período de tiempo transcurrido desde el momento que intervino el hecho lesivo y el momento de la aparición de los primeros problemas, síntomas y signos. No hay duda de su coincidencia en el tiempo. 
 
5.	Criterio de continuidad sintomática: En el caso de nuestra paciente se ha demostrado la continuidad de los síntomas con las sucesivas consultas de rehabilitación  que ha realizado. 
 
6.	Criterio de la integridad anterior o ausencia de estado anterior patológico previo al suceso traumático o lesivo: La paciente previamente no presentaba la sintomatología traumatológica puesto que previamente no había solicitado ninguna consulta médica por este motivo desde hacía años, confirmándolo su historial clínico y los informes previos. 
 
7.	Criterio de verosimilitud del diagnóstico etiológico: Conforme a este criterio podemos afirmar que un trabajo en las zonas donde tiene las patologías la paciente pueden causar las lesiones y las consecuencias que sufre en la actualidad. Pudiendo desencadenar una sintomatología traumatológica como las descritas. 
 
La sintomatología que sufre le produce restricciones para la normal movilidad y desempeño de sus actividades diarias, y por supuesto, de cualquier actividad que requiera un esfuerzo moderado con posiciones que demanden sobreesfuerzos del miembro superior. 
El trabajo desempeñado por la paciente requiere una serie de características y mínimas capacidades musculares que a continuación se detallan, basándonos en la Guía de Valoración Profesional de la Seguridad Social de 2014: 
 
•	Los agricultores y trabajadores calificados de huertas, invernaderos, viveros y jardines, planifican, organizan y realizan operaciones para cultivar y mantener árboles, arbustos, f",63b5a238-2a3a-4b7d-8a94-85bf94bfa561
d920981e-c506-40b2-bc5b-4276492aabf7,"conclusiones - 55 años, sufrió epicondilitis derecha mientras trabajaba como jardinera. La patologı́a evolucionó a crónica, limitando su capacidad para realizar tareas que requieren esfuerzo del brazo.","PRIMERA: 
La  paciente comienza a sufrir de la sintomatología de la epicondilitis, de manera incuestionable, cuando estaba trabajando en su puesto de trabajo, como así lo confirman las historias clínicas de su MAP (informe Clínico de su médico de Atención Primaria de fecha de 23/11/2015; partes de baja laboral de su Médico de Atención Primaria del 23/11/2015).
SEGUNDA:
A pesar del tratamiento farmacológico al que la paciente es sometida, la evolución de su sintomatología es progresiva; con dificultad por parte de los especialistas para controlarla y llegando a un punto en el que la mejoría es difícil de conseguir. 
TERCERA:
Se entiende el impedimento, desde el punto de vista traumatológico, para realizar su trabajo en condiciones óptimas cuando se produjo la lesión y en la actualidad, con una garantía mínima de esfuerzo y calidad, ya que no puede mantener posturas forzadas ni sostener un tono muscular adecuado para permitirle la ejecución de las tareas propias de su oficio durante horas; como así se demuestra viendo la evolución y su vida laboral desde que la fecha del hecho hasta ahora.
CUARTA:
Teniendo en cuenta los déficits hallados en la exploración y  viendo los requerimientos físicos que se observan en la Guía de Valoración Profesional por el Instituto Nacional de la Seguridad Social de 2014, se entiende que la paciente refiera dificultad para desarrollar su profesión. 
QUINTA
Dª Inmaculada, en la actualidad, ya padece de las enfermedades profesionales que pueden sufrir los trabajadores cualificados en huertas, invernaderos, viveros y jardines, y que vienen recogidas en la Guía de Valoración Profesional de la Seguridad Social de 2014. Por lo que, es lógico pensar que una continuidad en las funciones de su empleo conllevaran, inequívocamente, a un empeoramiento drástico de sus síntomas, ya de por sí intensos y limitantes. 
",1f68d145-e8fa-4962-ba29-7dade1d078fb
