id,Title,Text,pinecone_id
19268cfb-deb5-474e-87b4-f500d99cf7ec,"antecedentes documentos - Padece de migraña crónica, dolor pélvico crónico, depresión, tinnitus e hipoacusia. Su estado actual es depresivo, con disconfort, limitado para realizar actividades que requieran concentración","Las fuentes del informe en las que este perito se ha basado para la realización del presente documento han sido las siguientes, según orden cronológico:
•	Informe del servicio de Neurología del H. San Agustín de fecha 08/03/2021: Descripción de su proceso de migraña crónica donde dicen que actualmente la tiene a diario.
•	Informe del servicio de Psiquiatría del H. Fátima de fecha de 15/03/2021: Trastorno adaptativo mixto con gran repercusión a nivel somático.
•	Informe del servicio de Otorrinolaringología del H. San Agustín de fecha 21/04/2021: Descripción de los acúfenos intensos de un mes de evolución.
•	Informe del servicio de Neurología del H. San Agustín de fecha 12/05/2021: Descripción de su proceso de migraña crónica donde dicen que está en seguimiento desde 2016, que es migraña resistente a tratamiento y que actualmente la tiene a diario.
•	Informe del servicio de Neurología del H. San Agustín de fecha 02/07/2021: Descripción de su proceso de migraña que es resistente a tratamiento. 
•	Informe del servicio de Psiquiatría del H. Fátima de fecha de 13/07/2021: Trastorno adaptativo mixto en seguimiento. Resumen de su patología.
•	Informe del servicio de Neurología del H. U. V. Valme de fecha 20/07/2021: Descripción de su proceso de migraña crónica.
•	Informe del servicio de Psiquiatría del H. Fátima de fecha de 09/09/2021: Resumen de su patología y cambio de trastorno adaptativo a cuadro depresivo. Refiere insomnio resistente a benzodiacepinas y trazodona, con necesidad de potenciación de tratamiento antidepresivo con antipsicótico.
•	Informe del servicio de Psiquiatría del H. Fátima de fecha de 10/11/2021: Diagnostico de depresión. Seguimiento.
•	Informe del servicio de Neurología del H. U. V. Valme de fecha 15/12/2021: Descripción de su proceso de migraña crónica y cambios de medicación.
•	Informe del servicio de Otorrinolaringología del H. San Agustín de fecha 12/01/2022: Descripción de los tinnitus crónicos.
•	Informe del servicio de Psicología del H. San Agustín de fecha 13/01/2022: Es el seguimiento de psicología del paciente. Describe la evolución tórpida de la enfermedad.
•	Informe del servicio de Unidad del Dolor Satid de fecha 02/02/2022: Descripción de la patología del paciente y el proceso terapéutico de infiltración para bloqueo para el dolor. 
•	Informe del servicio de Urología del H. San Agustín de fecha 02/02/2022: Resumen de toda su patología urológica con derivación a la Unidad del Dolor.
•	Informe del servicio de Psiquiatría del H. Fátima de fecha de 10/02/2022: Resumen de su patología y refiere sin cambios con mala evolución.",00f73611-8384-41cc-9ba5-fdc9963ee44d
a811a677-3e22-42a4-abc5-e67f4362609e,"antecedentes doctor - Padece de migraña crónica, dolor pélvico crónico, depresión, tinnitus e hipoacusia. Su estado actual es depresivo, con disconfort, limitado para realizar actividades que requieran concentración","Don Jose Carlos desde hace años padece de diferentes patologías vinculadas a diferentes órganos y sistemas, que han sido tratadas con una enorme amplitud de tratamientos y que han sido imposible de controlar hasta el momento actual. A continuación se detalla la evolución de las mismas: 
1.	Urológica: Desde 2019 con sintomatología de dolor en suelo pélvico continuo y a diario, sin periodo de tiempo asintomático, debido a un proceso de prostatitis crónica resistente a tratamiento con antibióticos que le ha dejado como secuela una gran hipertonía del esfínter interno y externo vesical.
Para este proceso ha recurrido a múltiples tratamientos incluidos los quirúrgicos, sin obtener mejoría e incluso empeorando (informe del servicio de Neurología del H. U. V. Valme de fecha 15/12/2021). Por lo que ha sido remitido a la Unidad del Dolor para intentar paliarlo en la manera de lo posible.
2.	Neurológica: Don Jose Carlos padece de cuadros migrañosos o cefaleas desde 2006. En sus orígenes eran cuadros controlables con medicación analgésicas de bajo escalón terapéutico (por ejemplo antiinflamatorios) pero conforme transcurre el tiempo y ya en 2016 se van haciendo cada vez más continuos y constantes hasta hacerse diarios (informe del servicio de Neurología del H. San Agustín de fecha 12/05/2021) y asociar náusea, obnubilación y un estado de postración muy intenso. Por lo que su diagnóstico es de migraña crónica y se define la migraña crónica como la cefalea que ocurre 15 días o más al mes durante más de tres meses, es decir, una frecuencia desesperante.
Las cefaleas se han vuelto tan intensas y difíciles de controlar que el último planteamiento como tratamiento es el uso de anticuerpos monoclonales, que según La European Headache Federation (EHF) la recomendación de los expertos para su uso son: “Uso de AMC en aquellos pacientes con migraña crónica en los que hayan fallado al menos dos tratamientos preventivos; el fallo al tratamiento se define por ausencia de respuesta o por no poder ser utilizados como consecuencia de comorbilidades, efectos adversos o mala adherencia”.
3.	Otorrinolaringológica: En el mes de marzo de 2021 comienza con tinnitus o acufenos (sonidos anómalos y que suelen ser como un pitido, zumbido, ruido de red eléctrica, etc. Los más frecuentes suelen ser los de tono agudo. En los casos en los que molestan, pueden alterar el sueño y llegar a interferir con la concentración y realización de actividades cotidianas). Tras estudios pertinentes y tratamiento no consiguen curarlos como así lo menciona el médico otorrino en su informe del servicio de Otorrinolaringología del H. San Agustín de fecha 12/01/2022.
4.	Psiquiátrica: La patología psiquiátrica se ha ido desarrollando a lo largo de los años paralelamente y como consecuencia del resto de síntomas previamente descritos. Esta sintomatología era al principio catalogada como trastorno adaptativo, que se define como reacción de desajuste a una situación psicosocial estresante desarrollando un conjunto de síntomas emocionales o comportamentales que a menudo, los síntomas emocionales son de tipo ansioso; pero con la mala evolución de los síntomas (informe del servicio de Psiquiatría del H. Fátima de fecha de 09/09/2021) y la incapacidad de la medicina para paliar o controlar mínimamente el dolor, se ha transformado en un cuadro de depresión. Es bastante descriptivo como lo resumen en el informe del servicio de Psiquiatría del H. Fátima de fecha de 10/02/2022 cuando subrayan: “El cuadro psicopatológico permanece inalterado en la medida que lo hacen los estresores. Progresiva desvitalización y merma de su funcionalidad con gran dependencia de su evolución del dolor y la incertidumbre médica”.
Los dolores continuos que padece le ha llevado a un estado físico, psíquico y social limitado y realizando con muchísima dificultad las mínimas obligaciones para con su ámbito laboral y familiar, incluso muchas veces no teniendo más remedio que abandonar ambas.
",a4b5b73f-33e6-47e0-8ccf-3fe12d5295f1
cd694b1e-8417-42ca-9c5b-91f6fe118fa1,"estado actual - Padece de migraña crónica, dolor pélvico crónico, depresión, tinnitus e hipoacusia. Su estado actual es depresivo, con disconfort, limitado para realizar actividades que requieran concentración","Tras el examen de la documentación antes referida, el perito mantiene el 01/03/2022 la entrevista con el paciente. De esta entrevista se extrae las siguientes conclusiones:
En la esfera psíquica refiere un estado de ánimo pésimo, con discurso de desmoralización y depresivo, aunque coherente y fluido. Abordable, colaborador, con juicio de realidad conservado. No refiere clínica de corte psicótico, aunque sí verbaliza desesperanza y angustia. No se aprecia ideación autolítica. Rumiación de ideas continúas relacionadas con su situación actual. No mantiene la funcionalidad diaria y refiere padecer de mecanismos funcionales de afrontamiento ante situaciones estresantes, mostrando dificultades en la regulación emocional.
En cuanto a su vida diaria tiene limitaciones para las relaciones con su familia y poder llevar las labores normales de su día. Reseña que padece de dolor crónico de cabeza y pélvico diario e incesante que le obliga a tomar medicación con carácter preventivo, aunque no le surte demasiado efecto como mucho le cede parcialmente el dolor, y a descansar en cuanto ejecuta algún tipo de actividad que requiera una mínima exigencia física o mental (como ocuparse de su familia. Lo cual muchas veces no puede y los deja desatendidos según refiere).
Ha tenido que anular completamente su actividad lúdica debido a que su enfermedad no le permite mantener actividades que requieran una concentración mínima y una ejecución sin dolor.
EXPLORACIÓN  FÍSICA:
Paciente con dificultad para mantener una normal comunicación debido al tinnitus e hipoacusia que sufre.
Buen estado de cuidado personal y de nutrición.
El paciente ante la exploración física realizada presenta las siguientes características:
1.	Patología psiquiátrica: Tiene una serie de características de las cuales el paciente sufre en diferentes grados todas:
•	Sentimientos de tristeza, ganas de llorar, vacío o desesperanza.
•	Arrebatos de enojo, irritabilidad o frustración, incluso por asuntos de poca importancia.
•	Pérdida de interés o placer por la mayoría de las actividades habituales o todas, como las relaciones sexuales, los pasatiempos o los deportes.
•	Alteraciones del sueño, como insomnio o dormir demasiado.
•	Cansancio y falta de energía, por lo que incluso las tareas pequeñas requieren un esfuerzo mayor.
•	Falta de apetito y adelgazamiento, o más antojos de comida y aumento de peso.
•	Ansiedad, agitación o inquietud.
•	Lentitud para razonar, hablar y hacer movimientos corporales.
•	Sentimientos de inutilidad o culpa, fijación en fracasos del pasado o autorreproches.
•	Dificultad para pensar, concentrarse, tomar decisiones y recordar cosas.
•	Pensamientos frecuentes o recurrentes sobre la muerte, pensamientos suicidas, intentos suicidas o suicidio.
•	Problemas físicos inexplicables, como dolor de espalda o de cabeza.
2.	Exploración neurológica: No tiene ningún signo de enfermedad salvo que la cefalea no le deja ejecutar con agilidad las praxias (habilidades motoras adquiridas previamente).
",c0c0e29a-2290-46f6-abea-3a83bd8f2b87
1c6b22a1-2ba5-4395-a7c9-acbca90dde6a,"consideraciones medico-legales - Padece de migraña crónica, dolor pélvico crónico, depresión, tinnitus e hipoacusia. Su estado actual es depresivo, con disconfort, limitado para realizar actividades que requieran concentración","El comienzo del cuadro de dolor inflamatorio pélvico como consecuencia de la hipertonía esfinteriana vesical provocada por la prostatitis crónica, las cefaleas, la hipoacusia y el tinnitus y la depresión que le ha desencadenado los procesos previos, ha hecho que Don Jose Carlos tenga que estar durante años con diferentes equipos de especialistas y con diferentes tratamientos que no han paliado ni sanado dichas enfermedades.
Las visitas continuas a los servicios de urología, neurología, otorrinolaringología y psiquiatría por agravamiento, traen consigo la interrupción de su vida, un estado de desasosiego y ansiedad y limitaciones para el desarrollo de sus actividades diarias y de su trabajo.
El síndrome de dolor crónico inflamatorio pélvico se caracteriza por síntomas irritativos (o de llenamiento vesical), obstructivos (o síntomas de vaciamiento vesical) y dolores en el piso pélvico muscular (periné), en los genitales, en áreas de proyección urinaria (lumbar, inguinoescrotal, hipogastrio, uretral), y por supuesto con una disfunción sexual.
Estos pacientes no pueden hacer ejercicio, tienen trastornos del sueño, dificultad para disfrutar tiempo libre, pobre socialización, dificultades en la marcha, dificultades en la concentración e impacto negativo en su calidad de vida solo por el dolor desesperante que padecen. Solo con estos impedimentos (que se recoge en toda la literatura médica), y que D. Jose Carlos sufre de todas ellas en diferentes grados, se advierte la difícil situación que tiene para abordar cualquier situación social y familiar por muy banal que sea.
Véase como ejemplo que como consecuencia de la patología, el proceso miccional no es completo manifestándose con polaquiuria (aumento de la frecuencia de la micción), disuria (dolor en la micción),  oliguria (escasa cantidad de micción) y dolor a nivel de todo el sistema urológico desde la vejiga hasta la zona renal bilateral durante todo el día y en cada una de las micciones que realiza al día. El número de micciones que realiza es alto, mayor que el de cualquier persona sana, debido a que esa hipertonía no le permite vaciar la vejiga de manera completa y por lo tanto quedando volumen de orina en ella que provoca la sensación de tener que ir a miccionar de nuevo (se denomina medicamente tenesmo vesical); dicha acumulación de orina provoca distensión de las estructuras urológicas con la resultante de más dolor y posibilidades de sobreinfección urinaria.
Otra enfermedad que le merma diariamente al paciente es la cefalea o migraña crónica. La sintomatología clínica acompañante de la migraña crónica que soporta ha de ser valorada como factor incapacitante debido al abanico de síntomas que resiste, a la severidad y a la alta frecuencia de ellos (diariamente). Así se puede observar en la siguiente tabla:
SÍNTOMAS 	RIESGOS/LIMITACIONES LABORALES 
Alteraciones visuales y fotofobia 	Puestos de precisión, atención importante, conducción de vehículos o manejo de maquinaria peligrosa 
Alteraciones sensitivas, dolor, disminución de reflejos 	Manejo de maquinaria, conducción de vehículos, trabajos de precisión o tareas que requieran concentración y atención continuada 
Alteraciones motoras 	Tareas de precisión, concentración, conducción de vehículos, manejo de maquinaria 
Dolor severo/muy severo 	Limitación para cualquier actividad laboral durante la crisis 
Afectación de las funciones cognitivas: somnolencia, déficit de atención, alteración de la capacidad de concentración y disminución de la capacidad psicomotriz 	Tareas que requieran capacidad de concentración y atención. Conducción de vehículos, trasporte de viajeros o sustancias peligrosas, trabajos de precisión 
Dolor continuo, rigidez cervical, vértigo, acúfenos 	Actividades mentales con elevada carga mental, trabajos en alturas, conducción de vehículos, manejo de maquinaria peligrosa 
Así también adquieren importancia creciente los fármacos utilizados de forma habitual por D. Jose Carlos, tanto más cuanto que se asocian varios de ellos y pueden incrementarse sus efectos adversos con la consiguiente repercusión en cuanto a calidad y diligencia en su vida. Es común que los pacientes con migrañas crónicas, por sus especiales connotaciones clínicas, prolongado curso evolutivo y frecuencia de las crisis de dolor, usen o abusen de múltiples fármacos sintomáticos, preventivos o coadyuvantes (como así le ocurre a Don Jose Carlos). Un ejemplo de estos efectos se muestra esquematizado en la siguiente tabla:

FAMILIAS FARMAC",4c26748b-b7cc-4d42-b936-d93c95081f72
80ddea2e-d001-4c30-bdb2-18771a574805,"conclusiones - Padece de migraña crónica, dolor pélvico crónico, depresión, tinnitus e hipoacusia. Su estado actual es depresivo, con disconfort, limitado para realizar actividades que requieran concentración","PRIMERA. 
A pesar del intenso tratamiento farmacológico y psiquiátrico al que el paciente es sometido, la evolución de su sintomatología es progresiva y severa; con franca dificultad por parte de los especialistas para controlarla y, como consecuencia, es definida como de evolución tórpida y grave. 
SEGUNDA
Se entiende el impedimento, desde el punto de vista médico, para realizar ocupaciones en condiciones óptimas, con una garantía mínima de esfuerzo y calidad ya que tiene incluso dificul-tad para ayudar en las tareas del hogar.
TERCERA
Las cefaleas diarias que le dejan en un estado físico muy deteriorado durante las mismas a pesar del intenso tratamiento antimigrañoso que tiene prescrito; el dolor pél-vico continuo que le imposibilita acciones tan normales como miccionar sin dolor, y la patología psiquiátrica (depresión) y otorrinolaringológica que no le permite mantener una concentración, pericia, aptitud y agilidad mental adecuada, junto con la gran canti-dad de medicación que debe tomar y que tiene unos efectos secundarios (sedación, ma-reos, etc.) que le impediría la realización de tareas con la destreza aconsejada,  hacen que D. Jose Carlos no esté  en un estado físico mínimamente adecuado para mantener una jornada laboral continua y exitosa.
",2e7021fe-85da-4988-bd3d-21225eaf6ef8
e214897e-7897-490e-b695-a6ca5147c289,"antecedentes doctor - Teleoperadora,  61 años, sufre de lumbociatalgia y sı́ndrome de la cola de caballo con afectación neurológica. La patologı́a ha evolucionado durante años, con incontinencia y limitación para caminar","Las fuentes del informe en las que este perito se ha basado para la realización del presente documento han sido las siguientes, según orden cronológico:
•	Informe Médico de RNM de columna cervical del 12/08/2020: Como conclusión describen “Espondilolistesis L4-L5grado 1 con irregularidad en platillos vertebrales y discretos cambios degenerativos Modic tipo 1, asocia protrusión paramedial que impronta sobre el aspecto ventral del saco tecal con afectación preforaminal bilateral generando junto con cambios degenerativos posteriores una estenosis significativa del canal medular a este nivel con agrupación de las ralees de la cola de caballo. Disminución de espacio intervertebral L5-S1 con discretos cambios degenerativos Modic tipo I y abombamiento discal posterior. Se aprecia estenosis significativa el canal medular a nivel L4-L5 con agrupación de las rafees de la cola de caballo. El cono medular presenta una morfología y señal de intensidad normales y termina a nivel L 1-L2”.
•	Informe del Equipo de Valoración de Incapacidades de la S.S de fecha 24/05/2021: El mé-dico inspector resalta en conclusiones que ""Patología articular hombro izdo no domi-nante pendiente de cirugía con escasa limitación funcional en la actualidad. Pato-logía degenerativa raquis con clínica algica sin datos de afectación neurológica actual. Patología digestiva crónica funcional.”.
•	Informe del servicio de Traumatología y Ortopédica de fecha de 07/06/2021: Derivación a neurocirugía para valoración de cirugía.
•	Informe Médico de consultas externas de Neurocirugía de fecha de 09/09/2021: El doctor describe una ""Cuadro de dolor lumbar y ciática derecha que no le permite deambu-lar. Claudicación de la marcha a los 50m e incontinencia de esfínteres vesical y fe-cal” ; “Creo indicado IQx para foraminotomias bilaterales y colocación de DIE L4-L5. Doy CI y RDQ”.

Dª Dolores Reyes Delgado de 61 años de edad y de profesión, según la clasificación de la Guía de Valoración Profesional del INSS 2014, teleoperadora, comienza con un proceso de años de evolución de dolores a todos los niveles de la columna vertebral, describiéndolos más acentuados en región lumbar y en región lumbar derecha e irradiándose por el trayecto del nervio ciático derecho (que abarca desde la región del glúteo, región posterior de pierna y tobillo derecho), causándole  impotencia funcional importante ante cualquier postura mantenida y/o esfuerzo, e imposibilitándola para desenvolverse en las tareas más simples de su vida.
Debido a la tórpida evolución de los síntomas fue estudiada por traumatólogos y neurocirujanos los cuales le detectan una espondilolistesis y estenosis del canal vertebral con afectación de cola de caballo. 
En 2021 los dolores empiezan a ser más intensos y aparecer nueva sintomatología como la falta de control de sus esfínteres, perdiendo la capacidad de dominio de los mismos en cualquier momento y lugar. Por ello tuvo que reconsultar al servicio de neurocirugía del H. U. V. Rocío quienes observan la maltrecha evolución de la enferma: ""Cuadro de dolor lumbar y ciática derecha que no le permite deambular. Claudicación de la marcha a los 50m e incontinencia de esfínteres vesical y fecal ; creo indicado IQx para foraminotomias bilaterales y colocación de DIE L4-L5. Doy CI y RDQ”.
Una vez fueron estudiadas y valoradas todas las alternativas de tratamiento y ante la única posibilidad paliativa existente que consiste en una intervención quirúrgica, Dª Dolores solicitó la valoración por el Equipo de Valoración de Incapacidades de la S.S donde el médico inspector resalta que “tiene patología articular hombro izdo. no dominante pendiente de cirugía con escasa limitación funcional en la actualidad. Patología degenerativa raquis con clínica algica sin datos de afectación neurológica actual. Patología digestiva crónica funcional”, negándole dicha incapacidad.
",9ed3c36d-875b-4d2f-9660-043f98a997f1
52b0ec3b-7939-4543-8d77-73f7bd4e71c1,"estado actual - Teleoperadora,  61 años, sufre de lumbociatalgia y sı́ndrome de la cola de caballo con afectación neurológica. La patologı́a ha evolucionado durante años, con incontinencia y limitación para caminar","Tras el examen de la documentación antes referida, el perito mantiene el 11/11/2021 la entrevista con la paciente. De esta entrevista se extrae las siguientes conclusiones:
En la esfera psíquica refiere un estado de ánimo triste, con discurso de desmoralización, aunque coherente y fluido. Abordable, colaboradora, con juicio de realidad conservado. No refiere clínica de corte psicótico, aunque sí verbaliza desesperanza y angustia. Rumiación de ideas continúas relacionadas con su situación actual. 
Movimientos dolorosos de las articulaciones como signos llamativos en una primera inspección visual. Caminando con cierta inestabilidad como consecuencia de las dolencias articulares en su miembro inferior.
En cuanto a su vida diaria tiene limitaciones para poder llevar las labores normales de su día. Reseña que padece de dolor crónico e incesante en la columna en cuanto ejecuta algún tipo de actividad que requiera una mínima exigencia física (levantarse, mantenerse en bipedestación o desplazar objetos de pequeño tamaño por ejemplo).
EXPLORACIÓN  FÍSICA:
Paciente con movilidad tórpida por los dolores articulares. Buen estado de cuidado personal y de nutrición.
La paciente ante la exploración física realizada presenta las siguientes características:
Región lumbar:
1.	Deficiencia de la región lumbosacra debida a limitación de flexión-extensión. La amplitud media de flexión-extensión es 120º (90º flexión, 30º extensión).
a.	Grado de flexión de la paciente → Realiza hasta los 34 grados. Déficit de 56 grados.
b.	Grado de extensión de la paciente → Realiza hasta los 10 grados. Déficit de 20 grados.
2.	Deficiencia de la región lumbosacra debida a limitación de flexión lateral y anquilosis. La amplitud media de flexión lateral es de 50º (25º flexión lateral derecha, 25º flexión lateral izquierda).
a)	Flexión lateral derecha de la paciente → Realiza hasta los 10 grados. Déficit de 15 grados.
b)	Flexión lateral izquierda de la paciente → Realiza hasta los 11 grados. Déficit de 14 grados.
3.	Componente basado en el déficit neurológico.
a)	Pierna derecha con maniobra de Lassegue positiva a 30 grados.
4.	Balance Muscular: Se considera útil para graduar la debilidad muscular la ESCALA DE DANIELS:
a)	Ausencia de contracción. 0/5
b)	Se ve o palpa la contracción, pero no hay movimiento. 1/5
c)	Se produce movimiento en ausencia de gravedad. 2/5
d)	Movimiento que vence la gravedad. 3/5
e)	Hay fuerza contra la resistencia del examinador. 4/5
f)	Fuerza normal.
Todo esto secundado por las siguientes pruebas exploratorias:
1.	Pruebas de distancia dedos-suelo: (prueba de movilidad de todo el eje vertebral) Limitado a pasar solo las rodillas (grado 3).
2.	Signo de Ott positivo (disminución de la movilidad de la columna dorsal).
3.	Signo de Schober positivo (disminución de la movilidad de la columna lumbar).
4.	Prueba de rotación de la columna cervical: Limitación de la movilidad no cumpliendo todos los grados posibles, con detención brusca del mismo y dolor (indicativo de trastornos degenerativos como la espondiloartrosis).
5.	Prueba de percusión de las apófisis espinosas vertebrales positivas: Dolorosas. Indica inflamación o alteración ligamentosa a esos niveles.
6.	Prueba de Spurling positiva: Dolor en las carillas articulares vertebrales a la maniobra indicando irritación de las carillas articulares o una compresión de las raíces nerviosas.
7.	Prueba de hiperextensión lumbar positiva: Dolor intenso e incapacidad a la realización de la prueba.
",f6254c14-5478-497a-9279-5233f56ab17b
