id,Title,Text,pinecone_id
68e232af-e5ef-4190-8fca-b664451424e4,"consideraciones medico-legales - 40 años, con fibromialgia, trabaja como monitora de actividades recreativas. Sufre dolor crónico, fatiga, problemas de sueño, ansiedad y depresión.","El cuadro patológico de la paciente abarca aspectos reumatológicos, otorrinolaringológi-cos y psiquiátricos, y se caracteriza por su difícil control y tratamiento, según lo indican varios informes médicos. Estos informes, fechados en diferentes momentos desde 2008 hasta marzo de 2024, provienen de diversas instituciones médicas, incluyendo el Hospital Universitario Virgen Macarena, Hospital Universitario Virgen del Rocío, el Hospital San Juan de Dios del Consorcio Sa-nitario Público del Aljarafe, así como informes de su centro de salud y su médico de Atención Primaria (18/10/2023. Servicio de Médico de familia. Remarca la nula respuesta a tra-tamiento y la deriva a reumatología; 16/11/2023. Servicio de Médico de familia. Re-marca el severo empeoramiento de la paciente. En tratamiento incluso con antipsicóti-cos).
A lo largo de estos informes se destaca la tendencia a la cronificación de los síntomas de la paciente, a pesar de los múltiples cambios de dosis de tratamientos a los que ha sido sometida. Es notable el hecho de que en la mayoría de las visitas médicas a urgencias, se haya recurrido a la administración de opiáceos, como la petidina, debido a la persistencia de la sintomatología y la falta de alivio.
La paciente se ve obligada a recurrir constantemente a tratamiento farmacológico debido a las restricciones que experimenta en su movilidad, los dolores persistentes y las limitaciones que enfrenta para llevar a cabo sus actividades diarias y su trabajo. Específicamente, su ocupación demanda largas horas de actividad física continua y exigente, lo que agrava su condición y requiere un manejo cuidadoso del dolor y la carga física asociados. Esta dependencia del tratamiento farmacológico resalta la severidad de su situación.
Llegados a este punto conviene resaltar ciertos puntos de las enfermedades que padece la paciente.
La fibromialgia es una condición crónica que se caracteriza principalmente por dolor musculoesquelético generalizado y sensibilidad extrema en todo el cuerpo. Además del dolor, los síntomas comunes de la fibromialgia incluyen fatiga, trastornos del sueño, rigidez muscular y puntos de sensibilidad en áreas específicas del cuerpo llamados puntos gatillo. Aunque la causa exacta de la fibromialgia aún no se comprende completamente, se cree que implica una combinación de factores genéticos, físicos y psicológicos.
La fibromialgia puede tener un impacto significativo en la vida diaria de quienes la padecen y más concretamente en el caso de Doña Rosa como así se demuestra en las repercusiones siguientes:
1.	Dolor crónico: El dolor muscular generalizado es uno de los síntomas principales de la fibromialgia. Este dolor puede variar en intensidad y puede ser constante o intermitente. Puede afectar la capacidad para realizar actividades cotidianas como caminar, levantar objetos, e incluso el simple acto de permanecer sentado o acostado durante largos períodos de tiempo.
2.	Fatiga: La fatiga extrema es otro síntoma común de la fibromialgia. Esta fatiga no se alivia con el descanso y puede interferir con las actividades diarias normales, incluyendo el trabajo, las responsabilidades familiares y el tiempo de ocio.
3.	Trastornos del sueño: Las personas con fibromialgia a menudo experimentan dificultades para conciliar el sueño o mantenerlo durante la noche. Esto lleva a una sensación de cansancio persistente durante el día y dificulta la concentración y el enfoque en las tareas.
4.	Problemas cognitivos: También conocido como ""fibro niebla"" o ""niebla cerebral"", muchos pacientes con fibromialgia experimentan dificultades con la concentración, la memoria a corto plazo y el procesamiento de la información. Esto tiene un impacto en la capacidad del individuo para llevar a cabo actividades cognitivas complejas o para seguir instrucciones detalladas, lo que resulta particularmente relevante en situaciones que requieren el cuidado y la responsabilidad de niños en edad temprana, como ocurre en el trabajo de la paciente.
5.	Impacto en la salud mental: La fibromialgia también puede tener un impacto significativo en la salud mental, aumentando el riesgo de depresión, ansiedad y estrés. El dolor crónico y la fatiga afectan el estado de ánimo y la calidad de vida en general.
6.	Limitaciones en las actividades físicas: Debido al dolor y la fatiga, las personas con fibromialgia a menudo encuentran difícil participar en actividades físicas regulares. Esto lleva a un estilo de vida más sedentario, lo que a su vez empeora los sín",6e8f29ee-8860-4595-b6a7-08371f647380
fc025347-f2bb-443d-9e0c-c296d6cf772d,"conclusiones - 40 años, con fibromialgia, trabaja como monitora de actividades recreativas. Sufre dolor crónico, fatiga, problemas de sueño, ansiedad y depresión.","PRIMERA. 
La paciente, Doña Rosa Pinto Sanchez, sufre de una patología con manifestaciones limitan-tes sin posibilidad de tratamiento curativo, solo con perspectiva de opciones terapéuticas paliati-vas del dolor sin poder asegurar la mejoría de la misma.
SEGUNDA.
A pesar del tratamiento farmacológico al que la paciente es sometida, la evolución de su sintomatología es progresiva; con dificultad por parte de los especialistas para controlarla y lle-gando a un punto en el que la mejoría es difícil de conseguir.
TERCERA
La presencia de estas patologías conlleva una alta probabilidad de que se encuentre ac-tualmente incapacitada para desempeñar sus funciones laborales de manera diligente. Los sínto-mas asociados a esta condición limitan de forma significativa la capacidad para cumplir con sus responsabilidades laborales con la debida aplicación, diligencia y atención requerida, como así queda reflejado en la gran cantidad de informes médicos de especialistas que la han visto y que le hacen seguimiento en la actualidad.
",689449cd-ad9c-4f09-bc47-a58600f982f3
9d7126b6-e633-4316-94c2-eabd06d22f10,"antecedentes documentos - 61 años, Ferretero, con dolor crónico en articulaciones, Espondiloartrosis, deshidrataciones y protusiones discales L2-L3-L4, L4-L5 y L5-S1; Discopatı́a C6-C7. Limitación en su vida diaria y trabajo","Las fuentes del informe en las que este perito se ha basado para la realización del presente documento han sido las siguientes, según orden cronológico:
1.	Informe de revisión de consulta de especialidad de Medicina Integral del H. V. Rocío de Sevilla de fecha 24/10/2018: Resumen de la patología osteoarticular degenerativa y conclusiones de la calidad de vida del paciente.
2.	Hoja de seguimiento de consulta de Medicina de Familia de urgencias de fecha de la consulta de 23/04/2019: Le administran medicación intramuscular para el dolor.
3.	Informe de urgencias del H. V. Rocío de fecha 05/05/2019: Diagnostico de lumbalgia mecánica.
4.	Informe Médico de RNM de columna cervical del 01/06/2019: Como conclusión describen “rectificación cervical. Protrusión discal focal de base amplia en situación paracentral- foraminal izquierda del interespacio C6-C7 determinando estenosis del receso lateral y del foramen.”
5.	Informe Médico de RNM de columna lumbar del 11/12/2019: Como conclusión describen “Espondiloartrosis, deshidrataciones y protusiones discales L2-L3-L4, L4-L5 y L5-S1”.
6.	Informe de revisión de consulta de especialidad de Medicina Integral del H. V. Rocío de Sevilla de fecha 29/01/2020: “14 de Noviembre 2019: Bien controlado de la Fibrilación auricular. Control de Sintrom sin alteraciones. Dolor en región lumbar irradiado por la cara posterior de ambas piernas. Esta con vértigos y fatiga desde el punto de vista de la columna cervical. Solicito RNM de columna lumbar.”” 29 de Ene 2020: RNM ele columna lumbar: RM lumbosacra. Espondiloartrosis, deshidrataciones y protrusiones discales L2-3, L3-4, L4-5 y L5-S1.”
7.	Informe del servicio de Neurocirugía 28/10/2020 del H.U.V. Rocío: En la evolución el médico afirma que es remitido desde MI por astenia intensa con dolores articulares en rodillas y tobillos sin claros signos de sinovitis asociada.” Diagnóstico de Discopatía C6-C7”.
8.	Informe del Servicio de Urgencias de Rehabilitación y Traumatología del H. U. V. Rocío de fecha 05/04/2021:” Cambios degenerativos discovertebrales sin afectación radicular”.
",59fefa68-4d88-445c-ac6b-e7a1beae3b96
f5f757e0-7e71-466e-9f62-e4cec8d564c9,"antecedentes doctor - 61 años, Ferretero, con dolor crónico en articulaciones, Espondiloartrosis, deshidrataciones y protusiones discales L2-L3-L4, L4-L5 y L5-S1; Discopatı́a C6-C7. Limitación en su vida diaria y trabajo","Dª VICENTE DIAZ BOU de 61 años, y de profesión, según la clasificación de la Guía de Valoración Profesional del INSS 2014, Ferretero, sufre un deterioro de su estructura ósea desde hace años que le acarrea dolores articulares generalizados, mialgias, impotencia funcional, dificultad para la movilidad y astenia generalizada. Comenzó con estos problemas de salud de manera progresiva e intermitente en el tiempo, con periodos de mejoría, pero sin remitir del todo y estar asintomático. Transcurrido varios años, va dando paso a su vez a un deterioro psíquico debido a la frustración que le creaba el dolor e instaurándose de manera crónica.
Se decide practicar estudios médicos con resonancia magnética para conocer el alcance de la patología y por la persistencia del dolor e impotencia para mantener posturas forzadas de miembros superiores y cervicales y lumbares, y por lo tanto con incapacidad para realizar su trabajo. Como conclusión se describe que tiene “Espondiloartrosis, deshidrataciones y protusiones discales L2-L3-L4, L4-L5 y L5-S1; Diagnóstico de Discopatía C6-C7”.
Dº Vicente, en este periodo de tiempo, a parte del seguimiento por su MAP (médico de atención primaria), estuvo en sucesivas consultas de rehabilitación, traumatología y medicina integral (Informe de revisión de consulta de especialidad de Medicina Integral del H. V. Rocío de Sevilla de fecha 24/10/2018; Hoja de seguimiento de consulta de Medicina de Familia de urgencias de fecha de la consulta de 23/04/2019; Informe del servicio de Neurocirugía 28/10/2020 del H.U.V. Rocío) llegando a los siguientes diagnósticos: Espondiloartrosis, deshidrataciones y protusiones discales L2-L3-L4, L4-L5 y L5-S1; Diagnóstico de Discopatía C6-C7; lumbalgia mecánica.
El largo proceso patológico del paciente le ha llevado a ponerse bajo tratamiento analgésico de todo tipo e intensidad, necesitando la visita a urgencias en varias ocasiones para recibir tratamiento de urgencias. 
La evolución del paciente desde el aspecto traumatológico va siendo mala ya que la limitación que le causaba el dolor y el empeoramiento de su sintomatología repercute en su vida diaria y en su trabajo (Informe de revisión de consulta de especialidad de Medicina Integral del H. V. Rocío de Sevilla de fecha 29/01/2020) cuando describen: “14 de Noviembre 2019: Bien controlado de la Fibrilación auricular. Control de Sintrom sin alteraciones. Dolor en región lumbar irradiado por la cara posterior de ambas piernas. Esta con vértigos y fatiga desde el punto de vista de la columna cervical.”.
",2526bf31-cff9-40e1-84dc-189ba42bed92
5391b76d-d897-4def-bde7-79d466371900,"estado actual - 61 años, Ferretero, con dolor crónico en articulaciones, Espondiloartrosis, deshidrataciones y protusiones discales L2-L3-L4, L4-L5 y L5-S1; Discopatı́a C6-C7. Limitación en su vida diaria y trabajo","Tras el examen de la documentación antes referida, el perito mantiene el 28/06/2021, la entrevista con el paciente. De esta entrevista se extrae las siguientes conclusiones:
Don Vicente es una persona que padece de problemas y dolores traumatológicos desde hace años.
Su actividad física en la actualidad es limitada debido a su enfermedad, moviéndose con dificultad y temor ante la posibilidad de que se desencadene un dolor.
Don Vicente refiere un estado de ánimo preocupado por su situación actual y el desasosiego por su futuro más inmediato al haberse llevado años teniendo que acudir a continuas visitas médicas y sometiéndose a múltiples pruebas médicas, obteniendo una exigua expectativa de mejoría de su enfermedad.
Manifiesta su cada vez mayor impedimento para realizar actividades normales.
EXPLORACIÓN FÍSICA:
Paciente con buen estado general, orientado, con un aspecto físico bueno. A la inspección presenta buena coloración de piel y mucosas y buen estado de cuidado personal y de nutrición.
1.	Región cervical:
1.	Deficiencia de la región cervical debida a limitación de flexión-extensión. La amplitud media de flexión-extensión es 110º (50º flexión, 60º extensión).
Grado de flexión del paciente → Realiza hasta los 35 grados. Déficit de 10 	grados.
Grado de extensión del paciente → Realiza hasta los 30 grados. Déficit de 30º grados al desencadenarle leve cuadro vertiginoso.
2.	Deficiencia de la región cervical debida a limitación de flexión lateral y anquilosis. La amplitud media de flexión lateral es de 90º (45º flexión lateral derecha, 45º flexión lateral izquierda).
Flexión lateral derecha del paciente  → Realiza hasta los 35 grados. Déficit de 10 grados.
Flexión lateral izquierda del paciente → Realiza hasta los 34 grados. Déficit de 11 grados.
3.	Deficiencia de la región cervical debida a limitación de rotación. La amplitud media de rotación cervical es de 160º (80º R. dcha., 80º R. izda.).
		Rotación derecha  del paciente → Realiza hasta 70º. Déficit de 10º.
		Rotación izquierda del paciente  → Realiza hasta 70º. Déficit de 10º.
2.	Región dorsal:
1.	Deficiencia de la región dorsal debida a limitación de flexión-extensión. La amplitud media de flexión-extensión es 50º (50º flexión, 0º extensión).
Grado de flexión del paciente →  Realiza hasta los 45 grados. Déficit de grados.
Grado de extensión del paciente → Realiza hasta los 0 grados. Déficit de 0 	grados.
2.	Deficiencia de la región dorsal debida a limitación de rotación. La amplitud media de rotación dorsal es de 60º (30º rotación derecha, 30º rotación izquierda).
Rotación derecha  del paciente → Realiza hasta 10º. Déficit de 20º.
Rotación izquierda  del paciente → Realiza hasta 10º. Déficit de 20º.
3.	Región lumbar:
1.	Deficiencia de la región lumbosacra debida a limitación de flexión-extensión. La amplitud media de flexión-extensión es 120º (90º flexión, 30º extensión).
Grado de flexión del paciente → Realiza hasta los 34 grados. Déficit de 56 grados.
Grado de extensión del paciente → Realiza hasta los 10 grados. Déficit de 20 grados.
2.	Deficiencia de la región lumbosacra debida a limitación de flexión lateral y anquilosis. La amplitud media de flexión lateral es de 50º (25º flexión lateral derecha, 25º flexión lateral izquierda).
Flexión lateral derecha del paciente → Realiza hasta los 20 grados. Déficit de 5 grados.
Flexión lateral izquierda del paciente → Realiza hasta los 20 grados. Déficit de 5 grados.
	Todo esto secundado por las siguientes pruebas exploratorias: 
1.	Pruebas de distancia dedos-suelo: (prueba de movilidad de todo el eje vertebral) Limitado a pasar solo las rodillas (grado 3).
2.	Signo de Ott positivo (disminución de la movilidad de la columna dorsal).
3.	Signo de Schober positivo (disminución de la movilidad de la columna lumbar).
4.	Prueba de rotación de la columna cervical: Limitación de la movilidad no cumpliendo todos los grados posibles, con detención brusca del mismo y dolor (indicativo de trastornos degenerativos como la espondiloartrosis).
5.	Prueba de percusión de las apófisis espinosas vertebrales positivas: Dolorosas. Indica inflamación o alteración ligamentosa a esos niveles.
6.	Prueba de Spurling positiva: Dolor en las carillas articulares vertebrales a la maniobra indicando irritación de las carillas articulares o una compresión de las raíces nerviosas.
7.	Prueba de hiperextensión lumbar positiva: Dolor intenso e incapacidad a la realización de la prueba.

",914be8c4-fb76-4ce2-b9cd-96724539d417
0f6a3c36-b7a8-4838-bba5-8b56ede5c25d,"consideraciones medico-legales - 61 años, Ferretero, con dolor crónico en articulaciones, Espondiloartrosis, deshidrataciones y protusiones discales L2-L3-L4, L4-L5 y L5-S1; Discopatı́a C6-C7. Limitación en su vida diaria y trabajo","Como consecuencia de su patología requirió y requiere la atención continuada por diferentes equipos de especialistas y con diferentes tratamientos, con visitas continuas a los servicios de traumatología y médico de familia para someterse a controles rutinarios y a nuevos tratamientos para intentar frenar la sintomatología y para paliar, en la manera de lo posible, el agravamiento de su estado general. Presenta un cuadro patológico traumatológico consistente en dolores crónicos articulares más centrados en la columna lumbar y cervical que ha evolucionado hacia la cronificación como lo demuestra los diferentes cambios de tratamientos a los que se ha sometido y que no han sido capaz de paliarlo.
El trabajo desempeñado por el paciente requiere una serie de características y mínimas capacidades musculares que a continuación se detallan, basándonos en la Guía de Valoración Profesional de la Seguridad Social de 2014: 
Los dependientes en tiendas y almacenes venden una gama de productos y servicios por sí mismos al público o en nombre de establecimientos de venta al por mayor y por menor y explican las funciones y cualidades de dichos productos y servicios.
1.	VENDEDORES EN TIENDAS Y ALMACENES
Entre sus tareas se incluyen:
a.	Fijar los requisitos de los clientes y asesorarles sobre la gama de productos, su precio, condiciones de entrega, garantías, uso y cuidados;
b.	Explicar a los clientes los productos y servicios del establecimiento y hacer demostraciones de ellos;
c.	Vender los productos y servicios, cobrar su precio sirviéndose de distintos métodos de pago, preparar las facturas y registrar las ventas en cajas registradoras;
d.	Ayudar a la gestión cotidiana de las existencias mediante la realización de inventarios o la participación en ellos;
e.	Y exponer los productos para su venta, y envolver y embalar los ya vendidos.
2.	POSIBLES RIESGOS  Y CIRCUNSTANCIAS ESPECÍFICAS

a.	Posibles riesgos derivados del ambiente laboral:
-	Exposición a sustancias sensibilizantes
b.	Posibles riesgos derivados del material/herramientas de trabajo:
-	Los relacionados con posturas forzadas, posturas mantenidas, manejo de cargas.
-	Utilización de pantallas de visualización de datos
Teniendo en cuenta los déficits hallados en la exploración y viendo los requerimientos físicos que se observan en la Guía de Valoración Profesional por el Instituto Nacional de la Seguridad Social de 2014 equiparándola a vendedor en tienda y almacén, se entiende que el paciente refiera dificultad para desarrollar su profesión. Se puede aseverar que no puede ejercer sus funciones o responsabilidades de manera diligente y eficaz como puede ser un trabajo o labor que requiera el cumplimiento de un horario y unos objetivos determinados, más si es un trabajo que requiera esfuerzos físicos como el que tiene.

",7f920926-26b4-4fea-a695-b16dd751ea36
dcd43e59-8049-4e69-8c09-e82618910a37,"conclusiones - 61 años, Ferretero, con dolor crónico en articulaciones, Espondiloartrosis, deshidrataciones y protusiones discales L2-L3-L4, L4-L5 y L5-S1; Discopatı́a C6-C7. Limitación en su vida diaria y trabajo","PRIMERA: 
Se entiende el impedimento, desde el punto de vista traumatológico, para realizar su trabajo en condiciones óptimas, con una garantía mínima de esfuerzo y calidad, ya que no puede mantener posturas forzadas ni sostener un tono muscular adecuado para permitirle la ejecución de las tareas propias de su oficio durante horas.
SEGUNDA: 
A pesar del tratamiento farmacológico al que el paciente es sometido, la evolución de su sintomatología es progresiva; con dificultad por parte de los especialistas para controlarla y llegando a un punto en el que la mejoría es difícil de conseguir convirtiéndose en una enfermedad crónica.
",5297de37-6f30-4447-951d-830ff958df8c
4fc9f425-8f5d-46f2-989a-c705e2c91d93,"antecedentes documentos - 46 años, trabajadora de la ONCE, padece enfermedad de Crohn con colostomı́a, ceguera congénita en ojo derecho, coxalgia izquierda y pérdida de agudeza visual en ojo izquierdo. La enfermedad ha evolucionado con complicaciones, requiriendo intervenciones quirúrgicas y tratamiento paliativo","Las fuentes  del  informe  en  las  que  este perito  se  ha  basado para  la  realización del presente documento han sido las siguientes, según orden cronológico: 
•	Informe Clínico de su Digestivo del H. V. Rocío de fecha de primera consulta del 22/01/2007 y fecha de última consulta del 05/10/2020: Recoge la patología de la paciente “Enfermedad de Crohn con afectación de colon distal qué ha sido intervenida en tres ocasiones. Se ha realizado amputación abdominoperitoneal y colostomía definitiva”.
El 13/04/2020 el médico recoge lo siguiente: “refiere molestias abdominales cólicas previas a las deposiciones, que son de características líquidas generalmente. En ocasiones sangra por ostomía y con frecuencia se le despega la bolsa; Derivo a cirugía para valorar resección de segmento proximal a ostomía, que presenta estenosis importante. No me parece subsidiaria a otras opciones”. 
En el informe de EnteroRM de fecha de 10/12/19 incluido dentro del informe anterior escribe: “CONCLUSIÓN: Cambios postquirúrgicos. Signos de enfermedad fibroestenosante en colostomía . Sin datos concluyentes de actividad inflamatoria actual. No colecciones o fístulas”.
•	Informe de consultas de Traumatología del H. San Juan De Dios del Aljarafe de fecha 12/05/2020: Refieren la patología degenerativa de cadera candidata a sustitución por prótesis.
•	Informe de Oftalmología del H. H. San Juan De Dios del Aljarafe de fecha de 21/01/2021: “Infiltrados post conjuntivitis; OI: ISE difusos que afectan al eje visual, flúor negativo”. 
",d1c3621f-f0ef-4aab-a1fc-303eb0340225
0c08f30c-4fea-4a08-ad53-9e5ee3e0fa41,"antecedentes doctor - 46 años, trabajadora de la ONCE, padece enfermedad de Crohn con colostomı́a, ceguera congénita en ojo derecho, coxalgia izquierda y pérdida de agudeza visual en ojo izquierdo. La enfermedad ha evolucionado con complicaciones, requiriendo intervenciones quirúrgicas y tratamiento paliativo","Dª Milagros Gálvez Reyes de 46 años, y de profesión trabajadora de la ONCE como agente vendedor de nivel 1, sufre de un proceso patológico de años de evolución consistente en enfermedad de Crohn, enfermedad del intestino que produce una inflamación crónica de diferentes partes del tubo digestivo, y esto causa sus síntomas; ceguera completa del ojo derecho de origen congénito; y más recientemente coxalgia izquierda con dolor a cualquier movimiento de la pierna izquierda, y pérdida de agudeza visual de ojo izquierdo.
La enfermedad de Crohn se fue agravando, tuviendo que adoptar tratamientos más agresivos como fueron las 3 intervenciones quirúrgicas con amputación abdominoperineal y colostomía definitiva que le realizaron.
Con estas intervenciones consiguieron mantener el proceso de la enfermedad relativamente controlado pero siempre manteniendo una sintomatología de base que le ocasionaba impedimentos (meteorismo, dolor abdominal, recambios de la bolsa de colostomía por rebosamiento de las heces) y que le truncaban su normal desarrollo cotidiano.  En los últimos años la sintomatología de la bolsa de colostomía se ha ido agravando (cabe resaltar que la creación de un estoma no es un procedimiento exento de riesgo y su realización se asocia a una alta tasa de complicaciones que afectan a la calidad de vida además de suponer un gran impacto psicológico en el paciente), de tal forma que los cirujanos tienen que volver a intervenirla quirúrgicamente para paliar la estenosis del orifico que se le ha creado e intentar mejorar los síntomas acompañantes. 
La patología de cadera que le producía una coxalgia intensa también va empeorando con el tiempo de tal forma que los traumatólogos deciden operarla para la implantación de una prótesis de cadera.
Y hubo una última complicación consistente en una queratoconjuntivitis del único ojo con visión (el izquierdo), que le ha dejado una pérdida de agudeza visual moderada al dejarle definitivamente unos cúmulos de infiltrados numulares subepiteliales a nivel corneal.
Todas estas patologías se encuentran bajo estricto control médico y en tratamiento paliativo
",afde0aab-093a-43bf-890b-d3878ceb7450
